{
    "contract_version": "1.0.0",
    "specification_version": "1.0-draft.1",
    "target_profile": {
        "profile_id": "profile:ecmascript/2024",
        "profile_version": "1.2.0",
        "sha256": "5b012d7b0536610d4496718e6954c8f9ec80c16dde26a18f70663d0275ec333e"
    },
    "status": "equivalent_rewrite",
    "decisions": [
        {
            "requirement_id": "requirement:atomic.literal",
            "capability_id": "groups.atomic",
            "node_ids": ["node:target.atomic"],
            "status": "equivalent_rewrite",
            "reason_code": "literal_atomicity_redundant"
        }
    ]
}
